<?xml version="1.0" encoding="UTF-8"?>

<xsd:schema xmlns:xsd="http://www.w3.org/2001/XMLSchema"
            targetNamespace="https://focus_shift.de/jollyday/schema/holiday"
            xmlns="https://focus_shift.de/jollyday/schema/holiday"
            elementFormDefault="qualified">

  <xsd:simpleType name="Weekday">
    <xsd:restriction base="xsd:string">
      <xsd:enumeration value="MONDAY"/>
      <xsd:enumeration value="TUESDAY"/>
      <xsd:enumeration value="WEDNESDAY"/>
      <xsd:enumeration value="THURSDAY"/>
      <xsd:enumeration value="FRIDAY"/>
      <xsd:enumeration value="SATURDAY"/>
      <xsd:enumeration value="SUNDAY"/>
    </xsd:restriction>
  </xsd:simpleType>

  <xsd:simpleType name="Month">
    <xsd:restriction base="xsd:string">
      <xsd:enumeration value="JANUARY"/>
      <xsd:enumeration value="FEBRUARY"/>
      <xsd:enumeration value="MARCH"/>
      <xsd:enumeration value="APRIL"/>
      <xsd:enumeration value="MAY"/>
      <xsd:enumeration value="JUNE"/>
      <xsd:enumeration value="JULY"/>
      <xsd:enumeration value="AUGUST"/>
      <xsd:enumeration value="SEPTEMBER"/>
      <xsd:enumeration value="OCTOBER"/>
      <xsd:enumeration value="NOVEMBER"/>
      <xsd:enumeration value="DECEMBER"/>
    </xsd:restriction>
  </xsd:simpleType>

  <xsd:complexType name="RelativeToFixed">
    <xsd:complexContent>
      <xsd:extension base="Holiday">
        <xsd:sequence>
          <xsd:choice>
            <xsd:element name="Days" type="xsd:int" minOccurs="0"/>
            <xsd:element name="Weekday" type="Weekday" minOccurs="0"/>
          </xsd:choice>
          <xsd:element name="When" type="When"/>
          <xsd:element name="Date" type="Fixed"/>
        </xsd:sequence>
      </xsd:extension>
    </xsd:complexContent>
  </xsd:complexType>

  <xsd:complexType name="Holidays">
    <xsd:sequence>
      <xsd:element name="Fixed" type="Fixed" maxOccurs="unbounded" minOccurs="0"/>
      <xsd:element name="RelativeToFixed" type="RelativeToFixed" maxOccurs="unbounded" minOccurs="0"/>
      <xsd:element name="RelativeToWeekdayInMonth" type="RelativeToWeekdayInMonth" maxOccurs="unbounded" minOccurs="0"/>
      <xsd:element name="FixedWeekday" type="FixedWeekdayInMonth" maxOccurs="unbounded" minOccurs="0"/>
      <xsd:element name="ChristianHoliday" type="ChristianHoliday" maxOccurs="unbounded" minOccurs="0"/>
      <xsd:element name="IslamicHoliday" type="IslamicHoliday" maxOccurs="unbounded" minOccurs="0"/>
      <xsd:element name="FixedWeekdayBetweenFixed" type="FixedWeekdayBetweenFixed" maxOccurs="unbounded" minOccurs="0"/>
      <xsd:element name="FixedWeekdayRelativeToFixed" type="FixedWeekdayRelativeToFixed" maxOccurs="unbounded" minOccurs="0"/>
      <xsd:element name="EthiopianOrthodoxHoliday" type="EthiopianOrthodoxHoliday" maxOccurs="unbounded" minOccurs="0"/>
      <xsd:element name="RelativeToEasterSunday" type="RelativeToEasterSunday" minOccurs="0" maxOccurs="unbounded"/>
    </xsd:sequence>
  </xsd:complexType>

  <xsd:element name="Configuration" type="Configuration"/>

  <xsd:complexType name="Configuration">
    <xsd:sequence>
      <xsd:element name="Holidays" type="Holidays"/>
      <xsd:element name="Sources" type="Sources" minOccurs="0"/>
      <xsd:element name="SubConfigurations" type="Configuration" minOccurs="0" maxOccurs="unbounded"/>
    </xsd:sequence>
    <xsd:attribute name="hierarchy" type="xsd:string"/>
    <xsd:attribute name="description" type="xsd:string"/>
  </xsd:complexType>

  <xsd:complexType name="Source">
    <xsd:simpleContent>
      <xsd:extension base="xsd:string">
        <xsd:attribute name="of" type="xsd:string"/>
      </xsd:extension>
    </xsd:simpleContent>
  </xsd:complexType>

  <xsd:complexType name="Sources">
    <xsd:sequence>
      <xsd:element name="Source" type="Source" minOccurs="0" maxOccurs="unbounded"/>
    </xsd:sequence>
  </xsd:complexType>

  <xsd:complexType name="Fixed">
    <xsd:complexContent>
      <xsd:extension base="MoveableHoliday">
        <xsd:attribute name="month" type="Month"/>
        <xsd:attribute name="day">
          <xsd:simpleType>
            <xsd:restriction base="xsd:int">
              <xsd:minInclusive value="1"/>
              <xsd:maxInclusive value="31"/>
            </xsd:restriction>
          </xsd:simpleType>
        </xsd:attribute>
      </xsd:extension>
    </xsd:complexContent>
  </xsd:complexType>

  <xsd:simpleType name="When">
    <xsd:restriction base="xsd:string">
      <xsd:enumeration value="BEFORE"/>
      <xsd:enumeration value="AFTER"/>
      <xsd:enumeration value="CLOSEST"/>
    </xsd:restriction>
  </xsd:simpleType>

  <xsd:complexType name="FixedWeekdayInMonth">
    <xsd:complexContent>
      <xsd:extension base="MoveableHoliday">
        <xsd:attribute name="which" type="Which"/>
        <xsd:attribute name="weekday" type="Weekday"/>
        <xsd:attribute name="month" type="Month"/>
      </xsd:extension>
    </xsd:complexContent>
  </xsd:complexType>

  <xsd:simpleType name="Which">
    <xsd:restriction base="xsd:string">
      <xsd:enumeration value="FIRST"/>
      <xsd:enumeration value="SECOND"/>
      <xsd:enumeration value="THIRD"/>
      <xsd:enumeration value="FOURTH"/>
      <xsd:enumeration value="LAST"/>
    </xsd:restriction>
  </xsd:simpleType>

  <xsd:complexType name="RelativeToWeekdayInMonth">
    <xsd:complexContent>
      <xsd:extension base="Holiday">
        <xsd:sequence>
          <xsd:element name="FixedWeekday" type="FixedWeekdayInMonth"/>
        </xsd:sequence>
        <xsd:attribute name="weekday" type="Weekday"/>
        <xsd:attribute name="when" type="When"/>
      </xsd:extension>
    </xsd:complexContent>
  </xsd:complexType>

  <xsd:complexType name="IslamicHoliday">
    <xsd:complexContent>
      <xsd:extension base="MoveableHoliday">
        <xsd:attribute name="type" type="IslamicHolidayType"/>
      </xsd:extension>
    </xsd:complexContent>
  </xsd:complexType>

  <xsd:simpleType name="IslamicHolidayType">
    <xsd:restriction base="xsd:string">
      <xsd:enumeration value="NEWYEAR"/>
      <xsd:enumeration value="ASCHURA"/>
      <xsd:enumeration value="TASUA"/>
      <xsd:enumeration value="MAWLID_AN_NABI"/>
      <xsd:enumeration value="LAILAT_AL_MIRAJ"/>
      <xsd:enumeration value="LAILAT_AL_BARAT"/>
      <xsd:enumeration value="RAMADAN"/>
      <xsd:enumeration value="JUMUATUL_WIDA"/>
      <xsd:enumeration value="LAILAT_AL_QADR"/>
      <xsd:enumeration value="RAMADAN_END"/>
      <xsd:enumeration value="ID_AL_FITR"/>
      <xsd:enumeration value="ID_AL_FITR_2"/>
      <xsd:enumeration value="ID_AL_FITR_3"/>
      <xsd:enumeration value="ARAFAAT"/>
      <xsd:enumeration value="ID_UL_ADHA"/>
      <xsd:enumeration value="ID_UL_ADHA_2"/>
      <xsd:enumeration value="ID_UL_ADHA_3"/>
      <xsd:enumeration value="ID_AL_GHADIR"/>
      <xsd:enumeration value="GRAND_MAGAL_OF_TOUBA"/>
      <xsd:enumeration value="QAUMEE_DHUVAS"/>
      <xsd:enumeration value="EMBRACING_OF_ISLAM_DAY"/>
      <xsd:enumeration value="ARBAEEN"/>
      <xsd:enumeration value="DEATH_OF_MUHAMMAD_AND_HASAN_MOJTABA"/>
      <xsd:enumeration value="DEATH_OF_IMAM_REZA"/>
      <xsd:enumeration value="DEATH_OF_IMAM_HASAN_ASKARI"/>
      <xsd:enumeration value="BIRTH_OF_MUHAMMAD_AND_IMAM_SADIQ"/>
      <xsd:enumeration value="DEATH_OF_FATIMA"/>
      <xsd:enumeration value="BIRTH_OF_IMAM_ALI"/>
      <xsd:enumeration value="DEATH_OF_IMAM_ALI"/>
      <xsd:enumeration value="DEATH_OF_IMAM_SADIQ"/>
    </xsd:restriction>
  </xsd:simpleType>

  <xsd:simpleType name="ChronologyType">
    <xsd:restriction base="xsd:string">
      <xsd:enumeration value="JULIAN"/>
      <xsd:enumeration value="GREGORIAN"/>
    </xsd:restriction>
  </xsd:simpleType>

  <xsd:complexType name="ChristianHoliday">
    <xsd:complexContent>
      <xsd:extension base="MoveableHoliday">
        <xsd:attribute name="type" type="ChristianHolidayType"/>
        <xsd:attribute name="chronology" type="ChronologyType"/>
      </xsd:extension>
    </xsd:complexContent>
  </xsd:complexType>

  <xsd:simpleType name="HolidayType">
    <xsd:restriction base="xsd:string">
      <xsd:enumeration value="PUBLIC_HOLIDAY"/>
      <xsd:enumeration value="BANK_HOLIDAY"/>
      <xsd:enumeration value="OBSERVANCE"/>
    </xsd:restriction>
  </xsd:simpleType>

  <xsd:simpleType name="ChristianHolidayType">
    <xsd:restriction base="xsd:string">
      <xsd:enumeration value="GOOD_FRIDAY"/>
      <xsd:enumeration value="EASTER_MONDAY"/>
      <xsd:enumeration value="ASCENSION_DAY"/>
      <xsd:enumeration value="WHIT_MONDAY"/>
      <xsd:enumeration value="CORPUS_CHRISTI"/>
      <xsd:enumeration value="PALM_SUNDAY"/>
      <xsd:enumeration value="MAUNDY_THURSDAY"/>
      <xsd:enumeration value="ASH_WEDNESDAY"/>
      <xsd:enumeration value="MARDI_GRAS"/>
      <xsd:enumeration value="GENERAL_PRAYER_DAY"/>
      <xsd:enumeration value="CLEAN_MONDAY"/>
      <xsd:enumeration value="SHROVE_MONDAY"/>
      <xsd:enumeration value="PENTECOST"/>
      <xsd:enumeration value="CARNIVAL"/>
      <xsd:enumeration value="EASTER_SATURDAY"/>
      <xsd:enumeration value="EASTER_TUESDAY"/>
      <xsd:enumeration value="SACRED_HEART"/>
      <xsd:enumeration value="EASTER"/>
      <xsd:enumeration value="PENTECOST_MONDAY"/>
      <xsd:enumeration value="WHIT_SUNDAY"/>
    </xsd:restriction>
  </xsd:simpleType>

  <xsd:complexType name="FixedWeekdayBetweenFixed">
    <xsd:complexContent>
      <xsd:extension base="Holiday">
        <xsd:sequence>
          <xsd:element name="from" type="Fixed"/>
          <xsd:element name="to" type="Fixed"/>
        </xsd:sequence>
        <xsd:attribute name="weekday" type="Weekday"/>
      </xsd:extension>
    </xsd:complexContent>
  </xsd:complexType>

  <xsd:complexType name="Holiday" abstract="true">
    <xsd:attribute name="validFrom" type="xsd:int"/>
    <xsd:attribute name="validTo" type="xsd:int"/>
    <xsd:attribute name="every" type="HolidayCycleType" default="EVERY_YEAR"/>
    <xsd:attribute name="descriptionPropertiesKey" type="xsd:string"/>
    <xsd:attribute name="localizedType" type="HolidayType" default="PUBLIC_HOLIDAY"/>
  </xsd:complexType>

  <xsd:simpleType name="Substituted">
    <xsd:restriction base="xsd:string">
      <xsd:enumeration value="ON_SATURDAY"/>
      <xsd:enumeration value="ON_SUNDAY"/>
      <xsd:enumeration value="ON_WEEKEND"/>
      <xsd:enumeration value="ON_TUESDAY"/>
      <xsd:enumeration value="ON_WEDNESDAY"/>
    </xsd:restriction>
  </xsd:simpleType>

  <xsd:simpleType name="With">
    <xsd:restriction base="xsd:string">
      <xsd:enumeration value="NEXT"/>
      <xsd:enumeration value="PREVIOUS"/>
    </xsd:restriction>
  </xsd:simpleType>

  <xsd:complexType name="MovingCondition">
    <xsd:attribute name="substitute" type="Weekday"/>
    <xsd:attribute name="with" type="With"/>
    <xsd:attribute name="weekday" type="Weekday"/>
  </xsd:complexType>

  <xsd:complexType name="MoveableHoliday" abstract="true">
    <xsd:complexContent>
      <xsd:extension base="Holiday">
        <xsd:sequence>
          <xsd:element name="MovingCondition" type="MovingCondition" maxOccurs="unbounded" minOccurs="0"/>
        </xsd:sequence>
      </xsd:extension>
    </xsd:complexContent>
  </xsd:complexType>

  <xsd:complexType name="EthiopianOrthodoxHoliday">
    <xsd:complexContent>
      <xsd:extension base="Holiday">
        <xsd:attribute name="type" type="EthiopianOrthodoxHolidayType"/>
      </xsd:extension>
    </xsd:complexContent>
  </xsd:complexType>

  <xsd:simpleType name="EthiopianOrthodoxHolidayType">
    <xsd:restriction base="xsd:string">
      <xsd:enumeration value="TIMKAT"/>
      <xsd:enumeration value="ENKUTATASH"/>
      <xsd:enumeration value="MESKEL"/>
    </xsd:restriction>
  </xsd:simpleType>

  <xsd:complexType name="FixedWeekdayRelativeToFixed">
    <xsd:complexContent>
      <xsd:extension base="Holiday">
        <xsd:sequence>
          <xsd:element name="day" type="Fixed"/>
        </xsd:sequence>
        <xsd:attribute name="which" type="Which"/>
        <xsd:attribute name="weekday" type="Weekday"/>
        <xsd:attribute name="when" type="When"/>
      </xsd:extension>
    </xsd:complexContent>
  </xsd:complexType>

  <xsd:simpleType name="HolidayCycleType">
    <xsd:restriction base="xsd:string">
      <xsd:enumeration value="EVERY_YEAR"/>
      <xsd:enumeration value="TWO_YEARS"/>
      <xsd:enumeration value="THREE_YEARS"/>
      <xsd:enumeration value="FOUR_YEARS"/>
      <xsd:enumeration value="FIVE_YEARS"/>
      <xsd:enumeration value="SIX_YEARS"/>
      <xsd:enumeration value="ODD_YEARS"/>
      <xsd:enumeration value="EVEN_YEARS"/>
    </xsd:restriction>
  </xsd:simpleType>

  <xsd:complexType name="RelativeToEasterSunday">
    <xsd:complexContent>
      <xsd:extension base="Holiday">
        <xsd:sequence>
          <xsd:element name="chronology" type="ChronologyType"/>
          <xsd:element name="days" type="xsd:int"/>
        </xsd:sequence>
      </xsd:extension>
    </xsd:complexContent>
  </xsd:complexType>
</xsd:schema>
