<?xml version="1.0" encoding="UTF-8"?>

<Configuration hierarchy="cf" description="Central African Republic"
               xmlns="https://focus_shift.de/jollyday/schema/holiday"
               xmlns:xsi="http://www.w3.org/2001/XMLSchema-instance"
               xsi:schemaLocation="https://focus_shift.de/jollyday/schema/holiday https://focus_shift.de/jollyday/schema/holiday/holiday.xsd">
  <Holidays>
    <Fixed month="JANUARY" day="1" descriptionPropertiesKey="NEW_YEAR"/>
    <Fixed month="MARCH" day="29" descriptionPropertiesKey="BOGANDA"/>
    <Fixed month="MAY" day="1" descriptionPropertiesKey="LABOUR_DAY"/>
    <Fixed month="JUNE" day="30" descriptionPropertiesKey="christian.GENERAL_PRAYER_DAY"/>
    <Fixed month="AUGUST" day="13" descriptionPropertiesKey="INDEPENDENCE_DAY"/>
    <Fixed month="AUGUST" day="15" descriptionPropertiesKey="ASSUMPTION_DAY"/>
    <Fixed month="NOVEMBER" day="1" descriptionPropertiesKey="ALL_SAINTS"/>
    <Fixed month="DECEMBER" day="1" descriptionPropertiesKey="NATIONAL_DAY"/>
    <Fixed month="DECEMBER" day="25" descriptionPropertiesKey="CHRISTMAS"/>
    <ChristianHoliday type="EASTER_MONDAY"/>
    <ChristianHoliday type="ASCENSION_DAY"/>
    <ChristianHoliday type="WHIT_MONDAY"/>
    <IslamicHoliday type="ID_AL_FITR"/>
    <IslamicHoliday type="ID_UL_ADHA"/>
  </Holidays>

  <Sources>
    <Source>https://en.wikipedia.org/wiki/Public_holidays_in_Central_African_Republic</Source>
    <Source of="ISO 3166">https://www.iso.org/obp/ui/#iso:code:3166:CF</Source>
    <Source of="ISO 3166-2">https://en.wikipedia.org/wiki/ISO_3166-2:CF</Source>
  </Sources>

  <SubConfigurations hierarchy="ac" description="Ouham">
    <Holidays/>
  </SubConfigurations>
  <SubConfigurations hierarchy="bb" description="Bamingui-Bangoran">
    <Holidays/>
  </SubConfigurations>
  <SubConfigurations hierarchy="bgf" description="Bangui">
    <Holidays/>
  </SubConfigurations>
  <SubConfigurations hierarchy="bk" description="Basse-Kotto">
    <Holidays/>
  </SubConfigurations>
  <SubConfigurations hierarchy="hk" description="Haute-Kotto">
    <Holidays/>
  </SubConfigurations>
  <SubConfigurations hierarchy="hm" description="Haut-Mbomou">
    <Holidays/>
  </SubConfigurations>
  <SubConfigurations hierarchy="hs" description="Haute-Sangha / Mambéré-Kadéï">
    <Holidays/>
  </SubConfigurations>
  <SubConfigurations hierarchy="kb" description="Gribingui">
    <Holidays/>
  </SubConfigurations>
  <SubConfigurations hierarchy="kg" description="Kémo-Gribingui">
    <Holidays/>
  </SubConfigurations>
  <SubConfigurations hierarchy="lb" description="Lobaye">
    <Holidays/>
  </SubConfigurations>
  <SubConfigurations hierarchy="mb" description="Mbomou">
    <Holidays/>
  </SubConfigurations>
  <SubConfigurations hierarchy="mp" description="Ombella-Mpoko">
    <Holidays/>
  </SubConfigurations>
  <SubConfigurations hierarchy="nm" description="Nana-Mambéré">
    <Holidays/>
  </SubConfigurations>
  <SubConfigurations hierarchy="op" description="Ouham-Pendé">
    <Holidays/>
  </SubConfigurations>
  <SubConfigurations hierarchy="se" description="Sangha">
    <Holidays/>
  </SubConfigurations>
  <SubConfigurations hierarchy="uk" description="Ouaka">
    <Holidays/>
  </SubConfigurations>
  <SubConfigurations hierarchy="vk" description="Vakaga">
    <Holidays/>
  </SubConfigurations>
</Configuration>
