<?xml version="1.0" encoding="UTF-8"?>

<Configuration hierarchy="sn" description="Senegal"
               xmlns="https://focus_shift.de/jollyday/schema/holiday"
               xmlns:xsi="http://www.w3.org/2001/XMLSchema-instance"
               xsi:schemaLocation="https://focus_shift.de/jollyday/schema/holiday https://focus_shift.de/jollyday/schema/holiday/holiday.xsd">
  <Holidays>
    <Fixed month="JANUARY" day="1" descriptionPropertiesKey="NEW_YEAR"/>
    <Fixed month="APRIL" day="4" descriptionPropertiesKey="INDEPENDENCE_DAY"/>
    <Fixed month="MAY" day="1" descriptionPropertiesKey="LABOUR_DAY"/>
    <Fixed month="AUGUST" day="15" descriptionPropertiesKey="ASSUMPTION_DAY"/>
    <Fixed month="NOVEMBER" day="1" descriptionPropertiesKey="ALL_SAINTS"/>
    <Fixed month="DECEMBER" day="25" descriptionPropertiesKey="CHRISTMAS"/>

    <ChristianHoliday type="EASTER_MONDAY"/>
    <ChristianHoliday type="ASCENSION_DAY"/>
    <ChristianHoliday type="WHIT_MONDAY"/>

    <IslamicHoliday type="NEWYEAR"/>
    <IslamicHoliday type="ASCHURA"/>
    <IslamicHoliday type="MAWLID_AN_NABI"/>
    <IslamicHoliday type="ID_AL_FITR"/>
    <IslamicHoliday type="ID_UL_ADHA"/>
    <IslamicHoliday type="GRAND_MAGAL_OF_TOUBA"/>
  </Holidays>

  <Sources>
    <Source>https://en.wikipedia.org/wiki/Public_holidays_in_Senegal</Source>
    <Source of="ISO 3166-2">https://en.wikipedia.org/wiki/ISO_3166-2:SN</Source>
    <Source of="ISO 3166">https://www.iso.org/obp/ui/#iso:code:3166:SN</Source>
  </Sources>

  <SubConfigurations hierarchy="db" description="Diourbel">
    <Holidays/>
  </SubConfigurations>
  <SubConfigurations hierarchy="dk" description="Dakar">
    <Holidays/>
  </SubConfigurations>
  <SubConfigurations hierarchy="fk" description="Fatick">
    <Holidays/>
  </SubConfigurations>
  <SubConfigurations hierarchy="ka" description="Kaffrine">
    <Holidays/>
  </SubConfigurations>
  <SubConfigurations hierarchy="kd" description="Kolda">
    <Holidays/>
  </SubConfigurations>
  <SubConfigurations hierarchy="ke" description="Kédougou">
    <Holidays/>
  </SubConfigurations>
  <SubConfigurations hierarchy="kl" description="Kaolack">
    <Holidays/>
  </SubConfigurations>
  <SubConfigurations hierarchy="lg" description="Louga">
    <Holidays/>
  </SubConfigurations>
  <SubConfigurations hierarchy="mt" description="Matam">
    <Holidays/>
  </SubConfigurations>
  <SubConfigurations hierarchy="se" description="Sédhiou">
    <Holidays/>
  </SubConfigurations>
  <SubConfigurations hierarchy="sl" description="Saint-Louis">
    <Holidays/>
  </SubConfigurations>
  <SubConfigurations hierarchy="tc" description="Tambacounda">
    <Holidays/>
  </SubConfigurations>
  <SubConfigurations hierarchy="th" description="Thiès">
    <Holidays/>
  </SubConfigurations>
  <SubConfigurations hierarchy="zg" description="Ziguinchor">
    <Holidays/>
  </SubConfigurations>
</Configuration>
