<?xml version="1.0" encoding="UTF-8"?>
<Configuration hierarchy="vg" description="Virgin Islands (British)"
               xmlns="https://focus_shift.de/jollyday/schema/holiday"
               xmlns:xsi="http://www.w3.org/2001/XMLSchema-instance"
               xsi:schemaLocation="https://focus_shift.de/jollyday/schema/holiday https://focus_shift.de/jollyday/schema/holiday/holiday.xsd">
  <Holidays>
    <Fixed month="JANUARY" day="2" descriptionPropertiesKey="NEW_YEAR"/>
    <Fixed month="MARCH" day="6" descriptionPropertiesKey="STOUTTS_BIRTHDAY"/>
    <Fixed month="APRIL" day="7" descriptionPropertiesKey="christian.GOOD_FRIDAY"/>
    <Fixed month="APRIL" day="10" descriptionPropertiesKey="christian.EASTER_MONDAY"/>
    <Fixed month="MAY" day="8" descriptionPropertiesKey="KINGS_CORONATION"/>
    <Fixed month="MAY" day="29" descriptionPropertiesKey="christian.WHIT_MONDAY"/>
    <Fixed month="JUNE" day="16" descriptionPropertiesKey="SOVEREIGNS_BIRTHDAY"/>
    <Fixed month="JULY" day="3" descriptionPropertiesKey="VIRGIN_ISLANDS_DAY"/>
    <Fixed month="AUGUST" day="7" descriptionPropertiesKey="EMANCIPATION_MONDAY"/>
    <Fixed month="AUGUST" day="8" descriptionPropertiesKey="EMANCIPATION_TUESDAY"/>
    <Fixed month="AUGUST" day="9" descriptionPropertiesKey="EMANCIPATION_WEDNESDAY"/>
    <Fixed month="OCTOBER" day="16" descriptionPropertiesKey="HEROES_AND_FOREPARENTS_DAY"/>
    <Fixed month="NOVEMBER" day="27" descriptionPropertiesKey="1949_GREAT_MARCH_AND_RESTORATION"/>
    <Fixed month="DECEMBER" day="25" descriptionPropertiesKey="CHRISTMAS"/>
    <Fixed month="DECEMBER" day="26" descriptionPropertiesKey="BOXING_DAY"/>
  </Holidays>

  <Sources>
    <Source>https://bvi.gov.vg/media-centre/june-16-public-holiday-lieu-june-9</Source>
    <Source>https://bvi.gov.vg/media-centre/may-8-and-june-16-declared-public-holidays</Source>
    <Source>https://bvi.gov.vg/media-centre/monday-may-8-public-holiday</Source>
    <Source>https://bvi.gov.vg/media-centre/updatedofficialholidays20231</Source>
    <Source>https://bvi.gov.vg/media-centre/cabinet-approves-2023-public-holidays</Source>
  </Sources>
</Configuration>
