<?xml version="1.0" encoding="UTF-8"?>

<Configuration hierarchy="gh" description="Ghana"
               xmlns="https://focus_shift.de/jollyday/schema/holiday"
               xmlns:xsi="http://www.w3.org/2001/XMLSchema-instance"
               xsi:schemaLocation="https://focus_shift.de/jollyday/schema/holiday https://focus_shift.de/jollyday/schema/holiday/holiday.xsd">
  <Holidays>
    <Fixed month="JANUARY" day="1" descriptionPropertiesKey="NEW_YEAR">
      <MovingCondition substitute="SUNDAY" with="NEXT" weekday="MONDAY"/>
    </Fixed>
    <Fixed month="JANUARY" day="7" descriptionPropertiesKey="CONSTITUTION_DAY">
      <MovingCondition substitute="SUNDAY" with="NEXT" weekday="MONDAY"/>
    </Fixed>
    <Fixed month="MARCH" day="6" descriptionPropertiesKey="INDEPENDENCE_DAY">
      <MovingCondition substitute="SUNDAY" with="NEXT" weekday="MONDAY"/>
    </Fixed>
    <Fixed month="MAY" day="1" descriptionPropertiesKey="LABOUR_DAY">
      <MovingCondition substitute="SUNDAY" with="NEXT" weekday="MONDAY"/>
    </Fixed>
    <Fixed month="JULY" day="1" descriptionPropertiesKey="REPUBLIC_DAY">
      <MovingCondition substitute="SUNDAY" with="NEXT" weekday="MONDAY"/>
    </Fixed>
    <Fixed month="SEPTEMBER" day="21" descriptionPropertiesKey="FOUNDERS_DAY">
      <MovingCondition substitute="SUNDAY" with="NEXT" weekday="MONDAY"/>
    </Fixed>
    <Fixed month="DECEMBER" day="25" descriptionPropertiesKey="CHRISTMAS">
      <MovingCondition substitute="SUNDAY" with="NEXT" weekday="MONDAY"/>
    </Fixed>
    <Fixed month="DECEMBER" day="26" descriptionPropertiesKey="BOXING_DAY">
      <MovingCondition substitute="MONDAY" with="NEXT" weekday="TUESDAY"/>
    </Fixed>

    <FixedWeekday which="FIRST" weekday="FRIDAY" month="DECEMBER" descriptionPropertiesKey="FARMERS_DAY">
      <MovingCondition substitute="SUNDAY" with="NEXT" weekday="MONDAY"/>
    </FixedWeekday>

    <ChristianHoliday type="GOOD_FRIDAY"/>
    <ChristianHoliday type="EASTER_MONDAY"/>

    <IslamicHoliday type="ID_AL_FITR"/>
    <IslamicHoliday type="ID_UL_ADHA"/>
  </Holidays>

  <Sources>
    <Source>https://en.wikipedia.org/wiki/Public_holidays_in_Ghana</Source>
    <Source of="ISO 3166">https://www.iso.org/obp/ui/#iso:code:3166:GH</Source>
    <Source of="ISO 3166-2">https://en.wikipedia.org/wiki/ISO_3166-2:GH</Source>
  </Sources>

  <SubConfigurations hierarchy="aa" description="Greater Accra">
    <Holidays/>
  </SubConfigurations>
  <SubConfigurations hierarchy="af" description="Ahafo">
    <Holidays/>
  </SubConfigurations>
  <SubConfigurations hierarchy="ah" description="Ashanti">
    <Holidays/>
  </SubConfigurations>
  <SubConfigurations hierarchy="be" description="Bono East">
    <Holidays/>
  </SubConfigurations>
  <SubConfigurations hierarchy="bo" description="Bono">
    <Holidays/>
  </SubConfigurations>
  <SubConfigurations hierarchy="cp" description="Central">
    <Holidays/>
  </SubConfigurations>
  <SubConfigurations hierarchy="ep" description="Eastern">
    <Holidays/>
  </SubConfigurations>
  <SubConfigurations hierarchy="ne" description="North East">
    <Holidays/>
  </SubConfigurations>
  <SubConfigurations hierarchy="np" description="Northern">
    <Holidays/>
  </SubConfigurations>
  <SubConfigurations hierarchy="ot" description="Oti">
    <Holidays/>
  </SubConfigurations>
  <SubConfigurations hierarchy="sv" description="Savannah">
    <Holidays/>
  </SubConfigurations>
  <SubConfigurations hierarchy="tv" description="Volta">
    <Holidays/>
  </SubConfigurations>
  <SubConfigurations hierarchy="ue" description="Upper East">
    <Holidays/>
  </SubConfigurations>
  <SubConfigurations hierarchy="uw" description="Upper West">
    <Holidays/>
  </SubConfigurations>
  <SubConfigurations hierarchy="wn" description="Western North">
    <Holidays/>
  </SubConfigurations>
  <SubConfigurations hierarchy="wp" description="Western">
    <Holidays/>
  </SubConfigurations>
</Configuration>
