<?xml version="1.0" encoding="UTF-8"?>

<Configuration hierarchy="be" description="Belgium"
               xmlns="https://focus_shift.de/jollyday/schema/holiday"
               xmlns:xsi="http://www.w3.org/2001/XMLSchema-instance"
               xsi:schemaLocation="https://focus_shift.de/jollyday/schema/holiday https://focus_shift.de/jollyday/schema/holiday/holiday.xsd">
  <Holidays>
    <Fixed month="JANUARY" day="1" descriptionPropertiesKey="NEW_YEAR"/>
    <Fixed month="MAY" day="1" descriptionPropertiesKey="LABOUR_DAY"/>
    <Fixed month="JULY" day="21" descriptionPropertiesKey="NATIONAL_DAY"/>
    <Fixed month="AUGUST" day="15" descriptionPropertiesKey="ASSUMPTION_DAY"/>
    <Fixed month="NOVEMBER" day="1" descriptionPropertiesKey="ALL_SAINTS"/>
    <Fixed month="NOVEMBER" day="2" descriptionPropertiesKey="ALL_SOULS" localizedType="OBSERVANCE"/>
    <Fixed month="NOVEMBER" day="11" descriptionPropertiesKey="ARMISTICE"/>
    <Fixed month="DECEMBER" day="25" descriptionPropertiesKey="CHRISTMAS"/>
    <Fixed month="NOVEMBER" day="15" descriptionPropertiesKey="KINGS_FEAST" localizedType="OBSERVANCE" />
    <Fixed month="DECEMBER" day="31" descriptionPropertiesKey="NEW_YEARS_EVE" localizedType="OBSERVANCE"/>
    <ChristianHoliday type="EASTER"/>
    <ChristianHoliday type="EASTER_MONDAY"/>
    <ChristianHoliday type="ASCENSION_DAY"/>
    <ChristianHoliday type="PENTECOST"/>
    <ChristianHoliday type="PENTECOST_MONDAY"/>
  </Holidays>

  <Sources>
    <Source>https://en.wikipedia.org/wiki/Public_holidays_in_Belgium</Source>
    <Source of="ISO 3166">https://www.iso.org/obp/ui/#iso:code:3166:BE</Source>
    <Source of="ISO 3166-2">https://en.wikipedia.org/wiki/ISO_3166-2:BE</Source>
  </Sources>

  <SubConfigurations hierarchy="bru" description="Brussels">
    <Holidays/>
  </SubConfigurations>

  <SubConfigurations hierarchy="van" description="Antwerp">
    <Holidays/>
  </SubConfigurations>

  <SubConfigurations hierarchy="vbr" description="Flemish Brabant">
    <Holidays/>
  </SubConfigurations>

  <SubConfigurations hierarchy="vlg" description="Flanders">
    <Holidays/>
  </SubConfigurations>

  <SubConfigurations hierarchy="vli" description="Limburg">
    <Holidays/>
  </SubConfigurations>

  <SubConfigurations hierarchy="vov" description="East Flanders">
    <Holidays/>
  </SubConfigurations>

  <SubConfigurations hierarchy="vwv" description="West Flanders">
    <Holidays/>
  </SubConfigurations>

  <SubConfigurations hierarchy="wal" description="Wallonia">
    <Holidays/>
  </SubConfigurations>

  <SubConfigurations hierarchy="wbr" description="Walloon Brabant">
    <Holidays/>
  </SubConfigurations>

  <SubConfigurations hierarchy="wht" description="Hainaut">
    <Holidays/>
  </SubConfigurations>

  <SubConfigurations hierarchy="wlg" description="Liège">
    <Holidays/>
  </SubConfigurations>

  <SubConfigurations hierarchy="wlx" description="Luxembourg">
    <Holidays/>
  </SubConfigurations>

  <SubConfigurations hierarchy="wna" description="Namur">
    <Holidays/>
  </SubConfigurations>

</Configuration>
