<?xml version="1.0" encoding="UTF-8"?>
<tns:Configuration hierarchy="ua" description="Ukraine"
                   xmlns:tns="http://www.example.org/Holiday" xmlns:xsi="http://www.w3.org/2001/XMLSchema-instance"
                   xsi:schemaLocation="http://www.example.org/Holiday /Holiday.xsd">
    <tns:Holidays>
        <tns:Fixed month="JANUARY" day="1"/>
        <tns:Fixed month="JANUARY" day="7"/>
        <tns:Fixed month="MARCH" day="9"/>
        <tns:Fixed month="APRIL" day="13"/>
        <tns:Fixed month="MAY" day="1"/>
        <tns:Fixed month="MAY" day="4"/>
        <tns:Fixed month="MAY" day="11"/>
        <tns:Fixed month="JUNE" day="1"/>
        <tns:Fixed month="JUNE" day="29"/>
        <tns:Fixed month="AUGUST" day="24"/>
        <tns:Fixed month="OCTOBER" day="14"/>
    </tns:Holidays>
</tns:Configuration>
