<?xml version="1.0" encoding="UTF-8"?>

<Configuration hierarchy="kw" description="Kuwait"
               xmlns="https://focus_shift.de/jollyday/schema/holiday"
               xmlns:xsi="http://www.w3.org/2001/XMLSchema-instance"
               xsi:schemaLocation="https://focus_shift.de/jollyday/schema/holiday https://focus_shift.de/jollyday/schema/holiday/holiday.xsd">
  <Holidays>
    <Fixed month="JANUARY" day="1" descriptionPropertiesKey="NEW_YEAR"/>
    <Fixed month="FEBRUARY" day="25" descriptionPropertiesKey="NATIONAL_DAY"/>
    <Fixed month="FEBRUARY" day="26" descriptionPropertiesKey="LIBERATION_DAY"/>
    <IslamicHoliday type="NEWYEAR"/>
    <IslamicHoliday type="MAWLID_AN_NABI"/>
    <IslamicHoliday type="LAILAT_AL_MIRAJ"/>
    <IslamicHoliday type="ID_AL_FITR"/>
    <IslamicHoliday type="ID_AL_FITR_2"/>
    <IslamicHoliday type="ID_AL_FITR_3"/>
    <IslamicHoliday type="ARAFAAT"/>
    <IslamicHoliday type="ID_UL_ADHA"/>
    <IslamicHoliday type="ID_UL_ADHA_2"/>
    <IslamicHoliday type="ID_UL_ADHA_3"/>
  </Holidays>

  <Weekend weekday="THURSDAY" validTo="2006"/>
  <Weekend weekday="FRIDAY" validTo="2006"/>
  <Weekend weekday="FRIDAY" validFrom="2007"/>
  <Weekend weekday="SATURDAY" validFrom="2007"/>

  <Sources>
    <Source>https://en.wikipedia.org/wiki/Public_holidays_in_Kuwait</Source>
    <Source of="Weekend">https://www.arabnews.com/node/298933</Source>
    <Source of="ISO 3166">https://www.iso.org/obp/ui/#iso:code:3166:KW</Source>
    <Source of="ISO 3166-2">https://en.wikipedia.org/wiki/ISO_3166-2:KW</Source>
  </Sources>

</Configuration>
