<?xml version="1.0" encoding="UTF-8"?>
<Configuration hierarchy="hk" description="Hong Kong"
               xmlns="https://focus_shift.de/jollyday/schema/holiday"
               xmlns:xsi="http://www.w3.org/2001/XMLSchema-instance"
               xsi:schemaLocation="https://focus_shift.de/jollyday/schema/holiday https://focus_shift.de/jollyday/schema/holiday/holiday.xsd">
  <Holidays>
    <Fixed month="JANUARY" day="1" descriptionPropertiesKey="FIRST_DAY_OF_JANUARY"/>
    <Fixed month="FEBRUARY" day="16" descriptionPropertiesKey="LUNAR_NEW_YEARS_DAY"/>
    <Fixed month="FEBRUARY" day="17" descriptionPropertiesKey="SECOND_DAY_OF_LUNAR_NEW_YEAR"/>
    <Fixed month="FEBRUARY" day="19" descriptionPropertiesKey="THIRD_DAY_OF_LUNAR_NEW_YEAR"/>
    <Fixed month="MARCH" day="30" descriptionPropertiesKey="christian.GOOD_FRIDAY"/>
    <Fixed month="MARCH" day="31" descriptionPropertiesKey="DAY_FOLLOWING_GOOD_FRIDAY"/>
    <Fixed month="APRIL" day="2" descriptionPropertiesKey="christian.EASTER_MONDAY"/>
    <Fixed month="APRIL" day="5" descriptionPropertiesKey="CHING_MING_FESTIVAL"/>
    <Fixed month="MAY" day="1" descriptionPropertiesKey="LABOUR_DAY"/>
    <Fixed month="MAY" day="22" descriptionPropertiesKey="BIRTHDAY_OF_THE_BUDDHA"/>
    <Fixed month="JUNE" day="18" descriptionPropertiesKey="TUEN_NG_FESTIVAL"/>
    <Fixed month="JULY" day="2" descriptionPropertiesKey="HONG_KONG_SPECIAL_REGION"/>
    <Fixed month="SEPTEMBER" day="25" descriptionPropertiesKey="DAY_FOLLOWING_CHINESE_MID_AUTUMN"/>
    <Fixed month="OCTOBER" day="1" descriptionPropertiesKey="NATIONAL_DAY"/>
    <Fixed month="OCTOBER" day="17" descriptionPropertiesKey="CHUNG_YEUNG_FESTIVAL"/>
    <Fixed month="DECEMBER" day="25" descriptionPropertiesKey="CHRISTMAS"/>
    <Fixed month="DECEMBER" day="26" descriptionPropertiesKey="FIRST_WEEKDAY_AFTER_CHRISTMAS"/>
  </Holidays>
</Configuration>
