<?xml version="1.0" encoding="UTF-8"?>

<Configuration hierarchy="om" description="Oman"
                xmlns="https://focus_shift.de/jollyday/schema/holiday"
                xmlns:xsi="http://www.w3.org/2001/XMLSchema-instance"
                xsi:schemaLocation="https://focus_shift.de/jollyday/schema/holiday https://focus_shift.de/jollyday/schema/holiday/holiday.xsd">
  <Holidays>
    <Fixed month="JANUARY" day="1" descriptionPropertiesKey="NEW_YEAR"/>
    <Fixed month="JANUARY" day="11" descriptionPropertiesKey="ACCESSION_DAY"/>
    <Fixed month="JULY" day="23" descriptionPropertiesKey="RENAISSANCE_DAY"/>
    <Fixed month="OCTOBER" day="17" descriptionPropertiesKey="WOMENS_DAY"/>
    <Fixed month="NOVEMBER" day="20" descriptionPropertiesKey="NATIONAL_DAY"/>
    <Fixed month="NOVEMBER" day="21" descriptionPropertiesKey="NATIONAL_DAY"/>
    <IslamicHoliday type="NEWYEAR"/>
    <IslamicHoliday type="MAWLID_AN_NABI"/>
    <IslamicHoliday type="LAILAT_AL_MIRAJ"/>
    <IslamicHoliday type="RAMADAN_END"/>
    <IslamicHoliday type="ID_AL_FITR"/>
    <IslamicHoliday type="ID_AL_FITR_2"/>
    <IslamicHoliday type="ID_AL_FITR_3"/>
    <IslamicHoliday type="ARAFAAT"/>
    <IslamicHoliday type="ID_UL_ADHA"/>
    <IslamicHoliday type="ID_UL_ADHA_2"/>
    <IslamicHoliday type="ID_UL_ADHA_3"/>
  </Holidays>

  <Weekend weekday="FRIDAY"/>
  <Weekend weekday="SATURDAY"/>

  <Sources>
    <Source>https://en.wikipedia.org/wiki/Public_holidays_in_Oman</Source>
    <Source of="Weekend">https://gulfnews.com/world/gulf/oman/oman-to-follow-uniform-friday-saturday-weekend-1.1167447</Source>
    <Source of="ISO 3166">https://www.iso.org/obp/ui/#iso:code:3166:OM</Source>
    <Source of="ISO 3166-2">https://en.wikipedia.org/wiki/ISO_3166-2:OM</Source>
  </Sources>

  <SubConfigurations hierarchy="bj" description="Al Batinah South">
    <Holidays/>
  </SubConfigurations>
  <SubConfigurations hierarchy="bs" description="Al Batinah North">
    <Holidays/>
  </SubConfigurations>
  <SubConfigurations hierarchy="bu" description="Al Buraimi">
    <Holidays/>
  </SubConfigurations>
  <SubConfigurations hierarchy="da" description="Ad Dakhiliyah">
    <Holidays/>
  </SubConfigurations>
  <SubConfigurations hierarchy="ma" description="Muscat">
    <Holidays/>
  </SubConfigurations>
  <SubConfigurations hierarchy="mu" description="Musandam">
    <Holidays/>
  </SubConfigurations>
  <SubConfigurations hierarchy="sj" description="Ash Sharqiyah South">
    <Holidays/>
  </SubConfigurations>
  <SubConfigurations hierarchy="ss" description="Ash Sharqiyah North">
    <Holidays/>
  </SubConfigurations>
  <SubConfigurations hierarchy="wu" description="Al Wusta">
    <Holidays/>
  </SubConfigurations>
  <SubConfigurations hierarchy="za" description="Ad Dhahirah">
    <Holidays/>
  </SubConfigurations>
  <SubConfigurations hierarchy="zu" description="Dhofar">
    <Holidays/>
  </SubConfigurations>
</Configuration>
