<?xml version="1.0" encoding="UTF-8"?>
<Configuration hierarchy="mu" description="Mauritius"
               xmlns="https://focus_shift.de/jollyday/schema/holiday"
               xmlns:xsi="http://www.w3.org/2001/XMLSchema-instance"
               xsi:schemaLocation="https://focus_shift.de/jollyday/schema/holiday https://focus_shift.de/jollyday/schema/holiday/holiday.xsd">
  <Holidays>
    <Fixed month="JANUARY" day="1" descriptionPropertiesKey="NEW_YEAR"/>
    <Fixed month="JANUARY" day="2" descriptionPropertiesKey="NEW_YEAR"/>
    <Fixed month="FEBRUARY" day="10" descriptionPropertiesKey="CHINESE_SPRING_FESTIVAL"/>
    <Fixed month="FEBRUARY" day="1" descriptionPropertiesKey="ABOLITION_OF_SLAVERY"/>
    <Fixed month="JANUARY" day="25" descriptionPropertiesKey="THAIPOOSAM_CAVEDEE"/>
    <Fixed month="MARCH" day="8" descriptionPropertiesKey="MAHA_SHIVRATREE"/>
    <Fixed month="MARCH" day="12" descriptionPropertiesKey="INDEPENDENCE_AND_REPUBLIC_DAY"/>
    <Fixed month="APRIL" day="9" descriptionPropertiesKey="UGAADI"/>
    <Fixed month="APRIL" day="10" descriptionPropertiesKey="islamic.ID_AL_FITR"/>
    <Fixed month="MAY" day="1" descriptionPropertiesKey="LABOUR_DAY"/>
    <Fixed month="AUGUST" day="15" descriptionPropertiesKey="ASSUMPTION_BLESSED_VIRGIN_MARY"/>
    <Fixed month="SEPTEMBER" day="8" descriptionPropertiesKey="GANESH_CHATURTHI"/>
    <Fixed month="NOVEMBER" day="2" descriptionPropertiesKey="ARRIVAL_OF_INDENTURED_LABORERS"/>
    <Fixed month="OCTOBER" day="31" descriptionPropertiesKey="DIVALI"/>
    <Fixed month="DECEMBER" day="25" descriptionPropertiesKey="CHRISTMAS"/>
  </Holidays>

  <Sources>
    <Source>https://pmo.govmu.org/Communique/Notice%20-%20Final%20Public%20holidays%20-%202024.pdf</Source>
  </Sources>
</Configuration>
